Judul,Isi Berita,Link,Kategori
"Eks Kepala Bea Cukai Makassar Andhi Pramono Didakwa Terima Gratifikasi Rp58,9 M","Jakarta – Mantan Kepala Bea dan Cukai Makassar, Andhi Pramono akhirnya sampai di meja hijau persidangan usai terlibat kasus gratifikasi. Andhi Pramono dijatuhi dakwaan total Rp 58,9 miliar. Andhi Pramono menerima puluhan miliar uang tersebut dalam bentuk mata uang asing hingga rupiah.
Jaksa penuntut umum KPK pun membacakan rincian gratifikasi yang diterima oleh Andhi Pramono. Uang itu terdiri atas Rp 50,2 miliar, USD 264.500 atau sekitar Rp 3,8 miliar, dan SGD 409 ribu atau sekitar Rp 4,8 miliar.
""Menerima gratifikasi berupa uang seluruhnya berjumlah Rp 50.286.275.189,79 dan USD 264.500 atau setara dengan Rp 3.800.871.000,00. serta SGD 409 ribu atau setara dengan Rp 4.886.970.000,00 atau sekira jumlah tersebut, yang berhubungan dengan jabatannya dan yang berlawanan dengan kewajiban atau tugasnya, yakni berhubungan dengan jabatan Terdakwa selaku Pegawai Negeri pada Direktorat Jenderal Bea dan Cukai dan berlawanan dengan kewajiban Terdakwa,"" ujar jaksa KPK di ruang sidang Pengadilan Tipikor pada PN Jakarta Pusat, Rabu 22 November 2023.
Jaksa menyebut, Andhi Pramono telah melakukan gratifikasi tanpa melaporkannya ke KPK. Maka itu, Andhi dinilai melanggar Pasal 12C UU RI Nomor 31 Tahun 1999 tentang Pemberantasan Tindak Pidana Korupsi sebagaimana telah diubah dengan UU RI Nomor 20 Tahun 2001 tentang Perubahan atas UU Nomor 31 Tahun 1999 tentang Pemberantasan Tindak Pidana Korupsi.
""Terdakwa tidak pernah melaporkannya kepada Komisi Pemberantasan Korupsi (KPK) dalam waktu 30 (tiga puluh) hari kerja sejak penerimaan gratifikasi tersebut,"" kata dia.
Bahkan, jaksa juga menilai Andhi Pramono bersalah karena melakukan suap. Disebutkan oleh jaksa kalau uang gratifikasi Andhi Pramono berkaitan dengan jabatannya di Direktorat Jenderal Bea dan Cukai.
""Padahal penerimaan itu tanpa alas hak yang sah menurut hukum. Perbuatan Terdakwa Andhi Pramono yang menerima gratifikasi tersebut haruslah dianggap suap karena berhubungan dengan jabatan dan berlawanan dengan kewajiban atau baptis, yakni berhubungan dengan jabatan Terdakwa sebagai Pegawai Negeri pada Direktorat Jenderal Bea dan Cukai dan berlawanan dengan kewajiban Terdakwa,"" kata dia.
Jaksa menyakini Andhi Pramono melanggar Pasal 12B UU RI Nomor 31 Tahun 1999 tentang Pemberantasan Tindak Pidana Korupsi sebagaimana telah diubah dengan UU RI Nomor 20 Tahun 2001 tentang Perubahan atas UU Nomor 31 Tahun 1999 tentang Pemberantasan Tindak Pidana Korupsi juncto Pasal 65 ayat (1) KUHPidana.",https://www.viva.co.id/berita/nasional/1660182-eks-kepala-bea-cukai-makassar-andhi-pramono-didakwa-terima-gratifikasi-rp58-9-m?page=all,nasional
Jenderal Agus Subiyanto Buka Posko Pengaduan Jika Ada TNI Tak Netral di Pemilu,"Jakarta - Panglima TNI, Jenderal Agus Subiyanto memastikan TNI akan netral pada seluruh tahapan Pemilu Serentak 2024. Bahkan, kata dia, komitmen TNI menjunjung tinggi netralitas dalam Pemilu Serentak 2024 dengan membentuk posko pengaduan di setiap wilayah.
“Tentang netralitas TNI, dua hari yang lalu sudah kick off tentang netralitas dan pembuatan posko pengaduan. Jadi nanti di wilayah-wilayahh ada posko pengaduan,” kata Agus di Istana Negara pada Rabu, 22 November 2023.
Menurut dia, masyarakat bisa langsung mengadukan apabila melihat atau menemukan ada oknum TNI yang berpihak atau berpartisipasi terhadap para kandidat yang ikut dalam kontestasi Pemilu Serentak 2024. “Apabila ada oknum TNI yang tidak netral, itu bisa dilaporkan ke pos-pos tersebut,” ujarnya.
Selain itu, Agus sudah menginstruksikan kepada seluruh jajaran satuan dibawah untuk memberikan penyuluhan tentangg netralitas TNI sebagaimana tertuang dalam Undang-Undang Nomor 34 Tahun 2004 tentang TNI. “Prajurit tidak boleh berpolitik praktis,” jelas dia.
Kemudian, kata dia, Undang-Undang Nomor 7 Tahun 2017 tentang Pemilu bahwa apabila ada oknum TNI masih organik melakukan politik praktis akan ada tindakan pidana atau teguran pimpinannya. “Itu tertuang dalam buku saku yang kita berikan kepada seluruh prajurit, sehingga tau apa yang harus dilakukan dan tidak dilakukan,” kata Agus.
Disisi lain, Agus mengaku sudah melakukan deklarasi Pemilu Damai 2024 bersama Kapolri Jenderal Listyo Sigit Prabowo, Pangdam dan Kapolda di setiap wilayah. Menurutnya, deklarasi damai itu melibatkan seluruh elemen masyarakat.
“Tidak hanya TNI/Polri, KPU, Bawaslu yang ada di wilayah kemudian juga tokoh agama. Tokoh masyarakat, adat, LSM dan semua elemen masyarakat membuat pakta integritas tentang pemilu damai.. Kita harap pelaksanaan pemilu bisa berjalan sesuai dengan yang ditentukan dalam keadaan aman dan damai,” pungkasnya.",https://www.viva.co.id/berita/nasional/1660168-jenderal-agus-subiyanto-buka-posko-pengaduan-jika-ada-tni-tak-netral-di-pemilu?page=all,nasional
Firli Bahuri Resmi Jadi Tersangka Kasus Pemerasan SYL,"Jakarta – Polda Metro Jaya menetapkan Ketua Komisi Pemberantasan Korupsi, Firli Bahuri jadi tersangka kasus dugaan pemerasan terhadap eks Menteri Pertanian, Syahrul Yasin Limpo dalam penanganan kasus korupsi di Kementerian Pertanian (Kementan) tahun 2021.
""Menetapkan Saudara FB, selaku Ketua KPK RI sebagai tersangka,"" kata Direktur Reserse Kriminal Khusus Polda Metro Jaya, Komisaris Besar Polisi Ade Safri Simanjuntak kepada wartawan, Rabu 22 November 2023.
Untuk diketahui, Polda Metro Jaya menaikkan status kasus dugaan pemerasan yang dilakukan pimpinan Komisi Pemberantasan Korupsi (KPK) dalam penanganan kasus korupsi di Kementerian Pertanian (Kementan) tahun 2021 ke penyidikan.
""Selanjutnya direkomendasikan untuk dinaikkan status dari penyelidikan ke tahap penyidikan,"" ujar Direktur Reserse Kriminal Khusus Polda Metro Jaya, Komisaris Besar Polisi Ade Safri Simanjuntak kepada wartawan, Sabtu 7 Oktober 2023.
Firli Bahuri membantah
Dugaan pimpinan KPK yang melakukan pemerasan terhadap SYL dispekulasikan mengarah ke Firli Bahuri. Apalagi sempat beredar foto Firli dengan SYL di sebuah lapangan bulu tangkis.
Firli pun menjelaskan beredarnya foto pertemuan dirinya dengan SYL yang membuat publik geger. Foto tersebut beredar, setelah KPK menyelidiki kasus dugaan korupsi di Kementan era SYL.
Sementara, ada upaya laporan dugaan pemerasan oleh pimpinan KPK di Polda Metro Jaya. Adapun SYL sudah diperiksa Polda Metro Jaya, beberapa hari lalu.
Firli jelaskan, kalau pertemuan tersebut dilakukan sebelum dugaan korupsi di Kementerian Pertanian (Kementan) terjadi. Dia menyebut, pertemuan itu dilakukan pada Maret 2022, setahun lalu.
""Pertemuan di lapangan bulutangkis antara saya dengan Menteri Pertanian saat itu, saudara Syahrul Yasin Limpo, terjadi sebelum periode tersebut, tepatnya yaitu sekitar pada tanggal 2 Maret 2022. Dan itupun beramai-ramai di tempat terbuka,"" ujar Firli dalam keterangannya, Senin 9 Oktober 2023.",https://www.viva.co.id/berita/nasional/1660262-firli-bahuri-resmi-jadi-tersangka-kasus-pemerasan-syl?page=all,nasional
"Jadi Tersangka Pemerasan, Firli Bahuri Terancam Penjara Seumur Hidup!","Jakarta - Ketua Komisi Pemberantasan Korupsi (KPK), Firli Bahuri terancam pidana penjara seumur hidup buntut ditetapkan jadi tersangka kasus dugaan pemerasan atau penerimaan gratifikasi dalam penanganan korupsi Kementerian Pertanian (Kementan) 2021.
Firli bakal dikenakan Pasal 12e atau Pasal 12B atau Pasal 11 UU 31/1999 yang telah diubah dengan UU 20/2001 tentang perubahan atas UU 31/1999 tentang pemberantasan tindak pidana korupsi Juncto Pasal 65 KUHP.
Dalam rentetan pasal berlapis itu, Firli terancam hukuman paling berat penjara seumur hidup sebagaimana Pasal 12B Ayat 1 terkait penerimaan gratifikasi yang dilakukan bagi pegawai negeri atau penyelenggara negara. Hal itu diungkap Direktur Reserse Kriminal Khusus Polda Metro Jaya, Komisaris Besar Polisi Ade Safri Simanjuntak.
“Sebagaimana yang dimaksud Ayat 1, dipidana seumur hidup atau pidana penjara paling singkat empat tahun dan paling lama 20 tahun. Dan pidana denda paling sedikit Rp200 juta dan paling banyak Rp1 miliar,” kata dia kepada wartawan, Kamis 23 November 2023.
Ade menegaskan penetapan Firli jadi tersangka sesudah penyidik menemukan bukti yang cukup. Mantan Kapolres Kota Solo ini mengatakan, sedikitnya ada 91 orang telah diperiksa sebagai saksi kasus dugaan pemerasan ke eks Menteri Pertanian Syahrul Yasin Limpo (SYL) itu.
“Menetapkan saudara FB selaku ketua KPK RI sebagai tersangka dalam perkara dugaan tindak pidana korupsi berupa pemerasan atau penerimaan gratifikasi,” katanya.
Untuk diketahui, Polda Metro Jaya menaikkan status kasus dugaan pemerasan yang dilakukan pimpinan Komisi Pemberantasan Korupsi (KPK) dalam penanganan kasus korupsi di Kementerian Pertanian (Kementan) tahun 2021 ke penyidikan.
""Selanjutnya direkomendasikan untuk dinaikkan status dari penyelidikan ke tahap penyidikan,"" ujar Direktur Reserse Kriminal Khusus Polda Metro Jaya, Komisaris Besar Polisi Ade Safri Simanjuntak kepada wartawan, Sabtu 7 Oktober 2023.",https://www.viva.co.id/berita/nasional/1660272-jadi-tersangka-pemerasan-firli-bahuri-terancam-penjara-seumur-hidup?page=all,nasional
"Firli Bahuri Ditetapkan Tersangka, Eks Pegawai KPK: Alhamdulillah","Jakarta – Ketua wadah pegawai KPK Yudi Purnomo Harahap langsung memberikan sebuah respons usai Polda Metro Jaya resmi menetapkan Ketua KPK Firli Bahuri sebagai tersangka dugaan pemerasan ke Syahrul Yasin Limpo.
""Alhamdulillah, akhirnya, masa depan pemberantasan korupsi setidaknya akan ada harapan cerah, terima kasih polda metro jaya atas kerja keras dan profesional membersihkan KPK dari unsur korupsi,"" ujar Yudi daat dikonfirmasi wartawan, Kamis 23 November 2023 dinihari.
Yudi menuturkan kalau status Firli Bahuri bisa menjadi nonaktif usai resmi jadi tersangka. Dia pun berharap kalau Firli Bahuri bisa mundur sebagai ketua KPK.
""Oleh karena itu sebaiknya Firli mundur daripada jadi beban KPK,"" tegasnya.
Sebelumnya diberitakan, Polda Metro Jaya menetapkan Ketua Komisi Pemberantasan Korupsi, Firli Bahuri jadi tersangka kasus dugaan pemerasan terhadap eks Menteri Pertanian, Syahrul Yasin Limpo dalam penanganan kasus korupsi di Kementerian Pertanian (Kementan) tahun 2021.
""Menetapkan Saudara FB, selaku Ketua KPK RI sebagai tersangka,"" kata Direktur Reserse Kriminal Khusus Polda Metro Jaya, Komisaris Besar Polisi Ade Safri Simanjuntak kepada wartawan, Rabu 22 November 2023.",https://www.viva.co.id/berita/nasional/1660271-firli-bahuri-ditetapkan-tersangka-eks-pegawai-kpk-alhamdulillah?page=all,nasional
Kronologi Lengkap Kasus Mutilasi Mahasiswa UMY,"Yogyakarta – Dua terdakwa kasus mutilasi terhadap mahasiswa Universitas Muhammadiyah Yogyakarta (UMY) Redho Tri Agustian menjalani sidang perdana di Pengadilan Negeri (PN) Sleman, Daerah Istimewa Yogyakarta, Rabu 22 November 2023.
Dua terdakwa dalam kasus mutilasi ini adalah Waliyin (29) dan Ridduan (38). Keduanya menjalani sidang perdana yang digelar dengan dipimpin majelis hakim Cahyono dan didampingi dua hakim anggota yaitu Edy Antonno dan Hernawan.
Sementara Jaksa Penuntun Umum (JPU) yaitu Hanifah dan Evita Christin Pranatasari. JPU dalam sidang perdana ini membacakan surat dakwaan kepada dua terdakwa.
Dalam surat dakwaan itu terungkap kronologi lengkap dari kasus mutilasi terhadap korban Redho. Termasuk tentang aktivitas seksual menyimpang yang terjadi di dalamnya.
Evita mengatakan kasus mutilasi terhadap korban Redho ini berawal pada Minggu 9 Juli 2023 terdakwa dua yaitu Ridduan mendapatkan pesan di grup Facebook. Grup ini beranggotakan orang-orang yang memiliki penyimpangan seksual Bondage Dominance Sadism and Masochism (BDSM).
""Terdakwa dua (Ridduan) menghubungi terdakwa satu (Waliyin) yang berada di grup yang sama setelah mendapatkan pesan dari grup. Terdakwa satu menyetujui permainannya dilakukan di kosnya Krapyak, Triharjo, Sleman,"" kata Evita.
Kemudian pada Senin 10 Juli 2023 pukul 07.00 WIB terdakwa dua Ridduan pun berangkat ke Yogyakarta. Terdakwa dua Ridduan berangkat dengan memakai kereta api jurusan Jakarta-Yogyakarta.
Setibanya di Yogyakarta pukul 15.00 WIB, terdakwa dua Ruddian kemudian dijemput oleh terdakwa satu Waliyin. Berboncengan sepeda motor, keduanya kemudian berangkat menuju ke kos yang ditinggali terdakwa satu Waliyin di daerah Krapyak, Kabupaten Sleman, DIY.

Terdakwa satu Waliyin kemudian pada Senin 11 Juli 2023 menjemput korban Redho di tempat kosnya di Tamantirto, Kecamatan Kasihan, Kabupaten Bantul, DIY. Terdakwa satu Waliyin menjemput korban sekitar pukul 23.00 WIB.

Terdakwa satu Waliyin dan korban Redho kemudian berboncengan sepeda motor menuju kos di Krapyak, Kabupaten Sleman. Di kos milik terdakwa satu Waliyin ini sudah menunggu terdakwa dua Ruddian.

""Terdakwa dua (Ruddian) sudah menunggu di kos. Kemudian terdakwa satu (Waliyin) keluar meninggalkan kos. Terdakwa dua (Ruddian) dan korban masuk ke kamar tengah,"" ungkap Evita.
Terdakwa dua Ruddian dan korban Redho kemudian melakukan aktivitas seksual. Terdakwa dua Ruddian mengikat korban Redho dibagian tangan dan kaki demi memuaskan hasrat seksualnya.
Kemudian dia mengikat tangan dan kaki korban dengan memakai tali berwarna putih. Tak hanya itu, mulut korban Redho juga ditutup terdakwa dua Ruddian dengan lakban.
Usai mengikat korban Redho, terdakwa dua Ruddian memukuli korban di bagian perut dan dada dengan tangan kosong selama 15 menit. Setelah mengetahui korbannya kesakitan, terdakwa dua Ruddian beristirahat sejenak.
Usai beristirahat terdakwa dua Ruddian kembali memukuli korban Redho hingga terjatuh tak berdaya. Melihat korban Redho tak berdaya, terdakwa dua Ruddian kemudian menelpon terdakwa satu Waliyin untuk kembali ke kamar kos.
Saat itu kedua terdakwa sempat mengecek kondisi korban Redho di bagian leher dan masih merasakan ada detak nadi. ""Terdakwa satu Waliyin kemudian mengajak terdakwa dua Ruddian untuk membunuh korban,"" ucap Evita.
Usai membunuh korban, kedua terdakwa kemudian memutilasi tubuh korban. Tubuh korban kemudian dibuang kedua terdakwa ke beberapa lokasi. Kedua terdakwa untuk menghilangkan sidik jari dan jejak korban, sempat merebus beberapa bagian tubuh korban.
Usai membuang potongan tubuh korban, terdakwa dua Ridduan kemudian pulang ke Jakarta dengan menggunakan kereta api.
Evita dalam dakwaan primairnya mendakwa kedua terdakwa dengan Pasal 340 KUHP juncto Pasal 55 ayat 1 KUHP subsider Pasal 338 KUHP jo Pasal 351 ayat 1 ke 1 KUHP serta Pasal 351 ayat 3 KUHP jo Pasal 55 ayat (1) ke 1 KUHP tentang pembunuhan berencana dengan ancaman hukuman mati.
Usai JPU membacakan dakwaannya, Ketua Majelis Hakim Cahyono menanyakan apakah kedua terdakwa akan melakukan eksepsi. Kedua terdakwa usai berdiskusi dengan penasehat hukumnya kemudian memutuskan tidak melakukan eksepsi.",https://www.viva.co.id/berita/kriminal/1660261-kronologi-lengkap-kasus-mutilasi-mahasiswa-umy?page=all,nasional
"Tutupi Wajah Seperti Ninja, Caleg PKB Ngamuk Serang Kompetitor di Pasuruan","Pasuruan – Seorang Caleg muda PKB Kabupaten Pasuruan bernama Tri Wahyudi menyelinap ke kediaman sesama Caleg PKB, A Wasik Rahman Hamzah. Tri menyelinap berpakaian bak ninja melakukan penyerangan menggunakan tongkat besi ke keluarga A Wasik.
Tri Wahyudi adalah Caleg PKB Dapil 6, meliputi Kecamatan Sukorejo, Pandaan dan Prigen Kabupaten Pasuruan. Korban yang diserang juga Caleg satu dapil dengan Tri Wahyudi di Pileg 2024 mendatang.
Dalam rekaman CCTV rumah, keluarga A Wasik tampak menyerang balik menggunakan bangku murid mengaji dan peralatan menyapu untuk menghindari serangan ayunan tongkat besi yang dilakukan Tri Wahyudi.
Tri Wahyudi yang kemudian berhasil dilumpuhkan lalu dihajar dan diikat kemudian diserahkan ke Mapolsek Pandaan, Polres Pasuruan.
A Wasik Rahman Hamzah adalah Anggota DPRD Kabupaten Pasuruan Komisi 4. Dia mengatakan jika serangan ini terjadi pada pukul 20.00 WIB Selasa, 21 November 2023 kemarin. Awalnya pelaku bertamu ke rumahnya diterima langsung oleh istrinya di ruang tamu.
Saat itu A Wasik sedang kegiatan diluar dan istrinya yang tidak mengenal Tri Wahyudi pun memberitahukan kepada A Wasik kalau ada tamu.
Tak lama kemudian, Tri Wahyudi pamit ke toilet yang ada di luar dan kemudian tidak kembali ke ruang tamu. Sementara motornya tetap terparkir di halaman rumah yang jadi satu dengan lembaga pendidikan Al-Quran (TPQ).
""Saya yang datang sekitar pukul 22.00 WIB pun heran, ini motor siapa yang parkir. Saya tanya istri dan keluarga saya, semuanya tidak kenal. Akhirnya saya minta saudara saya menutup gerbang agar motornya tidak hilang dan saya masuk ke rumah untuk mandi,"" kata A Wasik pada Rabu, 22 November 2023 saat ditemui di rumahnya.
Belum sempat mandi terdengar suara gedoran pintu di lantai dua rumah, hingga membuat istrinya kaget. Wasik pun kemudian mengeceknya menggunakan senter ke lantai dua rumah.
""Di lantai dua tiba-tiba ada laki-laki (Tri Wahyudi) yang berpenutup wajah kayak ninja. Akhirnya senter-senteran, dia pakai kayak laser. Saya suruh turun. Tapi dia terus teriak sampai seluruh keluarga saya, kakak saya keluar dan mengira ada maling,"" ujar A Wasik.
Setelah itu, Wasik mengatakan Tri Wahyudi kabur ke ruangan kelas madrasah TPQ yang berdampingan dengan lantai dua rumahnya.
Wasik dan keluarnya pun kemudian mengejar dan terlibat aksi saling dorong pintu di ruangan kelas tempat persembunyian Tri Wahyudi. Lalu, Tri Wahyudi yang kalah dorongan, langsung menyerang menggunakan dua tongkat besi.
Para keluarga Wasik yang menggunakan alat seadanya pun berhasil menangkis, hingga membuat Tri Wahyudi kembali masuk ke dalam kelas. Kalah jumlah, Tri Wahyudi pun berhasil dilumpuhkan. Setelah itu barulah diketahui bahwa pelaku penyerangan adalah Tri Wahyudi yang sama-sama caleg dari PKB.
""Setelah dia diamankan ke Polsek, Orang tuanya Y (Tri Wahyudi) dipanggil, saya juga dipanggil untuk menyampaikan kronologi. Dalam pembicaraan kemarin dari orang tua ternyata mohon maaf si Y ini ada semacam depresi atau bagaimana gitu,"" tutur A Wasik.
Di satu sisi, Tri Wahyudi melalui media sosial pribadinya di Instagram mengungkapkan jika Wasik lah yang mengeroyoknya. ""Tetap stylish meskipun dikeroyok @bolomaswasik, di Sidomukti, Pandaan,"" tulis Tri Wahyudi dalam unggahan statusnya di akun Instagramnya.
Tri Wahyudi atau Yudi pun juga menyelipkan kata-kata aktivis Soe Hoek Gie. ""Lebih baik diasingkan dari pada menyerah pada kemunafikan,"" tulis Tri Wahyudi.
Namun, hingga sampai saat ini Tri Wahyudi belum bisa dihubungi untuk dikonfirmasi.",https://www.viva.co.id/berita/nasional/1660212-tutupi-wajah-seperti-ninja-caleg-pkb-ngamuk-serang-kompetitor-di-pasuruan?page=all,nasional
"Rizky Billar Lelang Mobil Pertamanya Rp250 Juta Buat Palestina, Apa Istimewanya?",Konten tidak ditemukan.,https://www.100kpj.com/mobil/21064-rizky-billar-lelang-mobil-pertamanya-rp250-juta-buat-palestina-apa-istimewanya?page=all,nasional
"Jepang Wajibkan Tes TBC Bagi Wisatawan dari 6 Negara, Ini Alasannya",Konten tidak ditemukan.,https://www.sahijab.com/update/8460-jepang-wajibkan-tes-tbc-bagi-wisatawan-dari-6-negara-ini-alasannya?page=all,nasional
"Kontroversi Seunghan RIIZE Sebelum Hiatus, BLACKPINK Syok Dipuji Raja Charles III",Konten tidak ditemukan.,https://www.intipseleb.com/lokal/88900-kontroversi-seunghan-riize-sebelum-hiatus-blackpink-syok-dipuji-raja-charles-iii?page=all,nasional
"Dangdut Populer: Potret Happy Asmara Waktu Masih SMA, Lesti Kejora Larang Billar Tinju",Konten tidak ditemukan.,https://jagodangdut.intipseleb.com/artikel/40157-dangdut-populer-potret-happy-asmara-waktu-masih-sma-lesti-kejora-larang-billar-tinju?page=all,nasional
SMRC: Gibran Belum Kuat Ambil Suara di Jateng,"Jakarta – Saidiman Ahmad, Peneliti Saiful Mujani Research Consulting (SMRC) mengatakan bahwa basis pemilih di Jawa Tengah (Jateng), yang merupakan wilayah terbesar pendukung Presiden RI Joko Widodo (Jokowi), tetap solid, dan tidak terpengaruh meski Gibran Rakabuming Raka menjadi calon wakil presiden (cawapres) dari Prabowo Subianto.
Menurut Saidiman, suara Jateng hingga saat ini sepenuhnya belum bergerak untuk mendukung Gibran, meski anak sulung dari Jokowi itu mencalonkan diri dalam ajang pilpres tahun 2024 dan secara eksplisit Jokowi terlihat mendukung Prabowo.
Meski demikian, Sidiman tidak menampik bahwa pergeseran pemilih tetap ada perubahan sebelum dan sesudah nama Gibran dideklarasikan menjadi cawapres Prabowo Subianto.
""Setelah anak Pak Jokowi menjadi cawapres, Pak Prabowo sendiri sekarang hasil surveinya ada peningkatan setelah deklarasi (nama cawapres),"" kata Saidiman dalam acara Gelora Talks ""Adu Kuat di Jawa Tengah Ganjar vs Gibran"", melalui Zoom Meeting, pada Rabu, 22 November 2023
""Pak Jokowi kan tidak secara ekspresif menyatakan dukungan, tetapi publik mendefinikasi Pak Jokowi mendukung Gibran. Kalau kita lihat memang ada survei-survei yang menunjukan perbandingan antara sebelum dan sesudah deklarasi. Dan setelah deklarasi di Jateng itu terlihat tidak ada perubahan signifikan.""
Meski suara di Jateng belum terlihat mengarahkan dukungannya ke Prabowo-Gibran, namun di Jawa Timur (Jatim) justru elektabilitas kubu capres-cawapres nomor urut 2 itu mengalami kenaikan yang cukup signifikan mengalahkan pasangan Ganjar Pranowo-Mahfud MD.
""Dukungan terhadap Ganjar Pranowo terakhir 44 persen, sekarang menjadi 32 persen, dan Prabowo 30 persen sekarang menjadi 49 persen,"" ujarnya.
Kilas balik saat pilpres 2019, Saidiman membeberkan bahwa saat itu Jokowi memenangkan suara Jateng hingga 77 persen. Angka tersebut, merupakan angka pendukung Jokowi di luar partai PDIP.
""Jateng ini memang kita lihat basis PDIP, di mana 2019 Pak Jokowi di sana memenangkan suara sebanyak 77 persen. Itu mayoritas (suara) Jokowi, PDIP hanya 29 persen.""",https://www.viva.co.id/berita/politik/1660288-smrc-gibran-belum-kuat-ambil-suara-di-jateng?page=all,politik
Yusril Yakin Tak Ada Pelanggaran Pemilu saat Acara Kepala Desa di GBK,"Jakarta – Pakar Hukum Tata Negara sekaligus Wakil Ketua Dewan Pengarah Tim Kampanye Nasional Prabowo-Gibran, Yusril Ihza Mahendra mengatakan kekhawatiran Andika Perkasa atas kehadiran kepala desa mendukung Prabowo-Gibran di GBK, pada hari Minggu, 19 November 2023 lalu sama sekali tidak beralasan.
Yusril mengungkapkan, deklarasi mendukung Pasangan Calon Presiden dan Wapres Prabowo-Gibran oleh para Kepala Desa sama sekali tak ada.
""Saya sendiri hadir di GBK dari pukul 10.30 sampai acara selesai, tidak satu katapun mendengar ucapan deklarasi yang dimaksud,"" kata Yusril, dalam keterangan yang diterima, Rabu 22 November 2023.
Yusril menambahkan, begitu juga perwakilan dari Bawaslu yang hadir dalam acara tersebut, juga menyatakan hal yang sama. ""Jadi kalau deklarasi dukungan itu tidak pernah ada, maka apa yang dikhawatirkan Andika yakni para kepala desa itu bisa dikenai sanksi baik pidana maupun administratif tentu tidak akan terjadi,"" kata Yusril
Dia mengungkapkan, yang terjadi adalah seperti yang disampaikan perwakilan 7 pimpinan organisasi desa. Karena satu diantaranya berhalangan, mereka menyampaikan aspirasi, harapan, tuntutan atas beragam persoalan desa yang selama ini mengganjal kinerja mereka.
""Hukum harus ditegakkan di atas bukti, bukan di atas ilusi"" tegas Yusril.
Delik Pemilu, menurut Yusril adalah delik materil, bukan delik formil. Jadi pelanggaran baru bisa dikenai sanksi jika perbuatan materil, yakni deklarasi dukungan Prabowo-Gibran benar-benar terjadi. Jika baru niat, tetapi belum diwujudkan, maka tidak bisa dikenai sanksi hukum apapun.
Yusril menyebut, harapan yang selama ini masih mengganjal para kades dan mantan kades itulah yang disampaikan pimpinan organisasi desa di depan Calon Wakil Presiden Gibran Rakabuming Raka.
Mengingat aspirasi yang disampaikan satu persatu, perwakilan sangat detail. Maka, Calon Wakil Presiden Koalisi Indonesia Maju, Gibran mendengar dengan seksama seluruh keluhan para kepala desa dan mantan kades tersebut.
Jadi, lanjut Yusril, pertemuan tahunan para kepala desa yang berbentuk Silaturrahmi Nasional Para Kepala Desa seluruh Indonesia, sama sekali tidak ada deklarasi. ""Karena kami memahami Deklarasi jelas melanggar aturan Pemilu, karena calon telah ditetapkan, namun masa kampanye belum dimulai,"" ujar Yusril.
Dalam acara itu, kata Yusril, Calon Presiden Prabowo Subianto juga tidak hadir. Calon Wakil Presiden Gibran Rakabuming Raka juga baru tiba di acara pukul 15.30 WIB, sementara peserta dan undangan telah berdatangan sejak jam 10.00 pagi.
""Saya sendiri berkeyakinan bahwa tidak ada pelanggaran hukum apapun yang dilakukan Prabowo dan Gibran dalam acara di GBK tersebut"" tegas Yusril.
Yusril mengatakan, Kalaupun ada pihak-pihak mengatakan ada pelanggaran, maka itu harus dibuktikan di Bawaslu terlebih dahulu. Karena dalam soal Pemilu, Bawaslu yang berwenang memutuskan ada pelanggaran atau tidak, sebelum masalahnya dibawa ke ranah hukum.
""Kami dari TKN Koalisi Indonedia Maju, siap saja menghadapi pelapor atau pengadu di sidang Bawaslu maupun di pengadilan nanti. Kami siap saja untuk itu"" tegas Yusril.",https://www.viva.co.id/berita/politik/1660259-yusril-yakin-tak-ada-pelanggaran-pemilu-saat-acara-kepala-desa-di-gbk?page=all,politik
